<?xml version="1.0" encoding="UTF-8"?>
<xs:schema xmlns:xs="http://www.w3.org/2001/XMLSchema">

  <!-- Root element -->
  <xs:element name="students">
    <xs:complexType>
      <xs:sequence>
        <xs:element name="student" maxOccurs="unbounded">
          <xs:complexType>
            <xs:sequence>
              <xs:element name="name" type="xs:string"/>
              <xs:element name="roll" type="xs:integer"/>
              <xs:element name="department" type="xs:string"/>
              <xs:element name="email" type="xs:string"/>
              <xs:element name="subjects">
                <xs:complexType>
                  <xs:sequence>
                    <xs:element name="subject" type="xs:string" maxOccurs="unbounded"/>
                  </xs:sequence>
                </xs:complexType>
              </xs:element>
            </xs:sequence>
          </xs:complexType>
        </xs:element>
      </xs:sequence>
    </xs:complexType>
  </xs:element>

</xs:schema>
